{
  "id": "sub_123",
  "plan": {
    "id": "basic",
    "name": "Basic",
    "price_cents": 999,
    "interval": "month",
    "devices": 1,
    "quality": "HD"
  },
  "status": "active",
  "current_period_start": "2025-09-01T00:00:00Z",
  "current_period_end": "2025-10-01T00:00:00Z",
  "cancel_at_period_end": false
}